{
  "metadata": {
    "project": "spec-kit",
    "displayName": "Spec-Driven Development Kit",
    "version": "0.1.0",
    "owner": "bbela",
    "language": "pt-BR",
    "createdAt": "2026-08-30",
    "harness": "multi (opencode/claude/cursor/codex/gemini/agy/antigravity 2.0/ide)",
    "status": "v0.1.0 — pack spec-kit implementado (33/33 tasks concluídas, 94 testes passando, TDD)",
    "source": "spec-kit.orchestration.json + docs/01-10 + control-center.orchestration.json"
  },
  "sharedContext": {
    "objetivo": "Construir o pack npm spec-kit: catálogo global generalista (templates) + generators de squad local 100% especialista por projeto (Context7), orquestrado por PO que entrevista, classifica dificuldade e escolhe modelo por task, com governança PRD+ledger JSON+MD, Ralph Loop por task, docs 100% técnico+funcional com DOC_SYNC, pentest reverso combinado, multi-harness 8 alvos.",
    "principios": [
      "Arquitetura limpa/organizada (clean architecture adaptada por projeto)",
      "Código pouco verboso, direto, seguindo ESLint",
      "Testes unitários em TODAS as linguagens + TDD quando fizer sentido",
      "QA forte e documentação 100% obrigatória",
      "Cobertura total de domínios: performance, SEO, i18n, UX/UI, design-system, design-patterns, media-buying, security",
      "Pentest reverso combinado (agente + hook gate + checklist + governance)",
      "Orquestração de TODAS as alterações via ledger de governança",
      "Catálogo GLOBAL generalista + squad LOCAL 100% especialista (multiagent)",
      "Squad usa Context7 para docs específicas de stack/versão",
      "PO entrevista o dev e assume papel de gerente de projeto (spec completa)",
      "Greenfield (spec-first) ≠ legado (verify-docs -> doc-gen -> spec/change)"
    ],
    "stackPack": {
      "runtime": "Node.js >=20, TypeScript",
      "cli": "bin/spec-kit",
      "tests": "vitest",
      "lint": "eslint",
      "docs": "docsify (docs/)",
      "distribution": "npm package spec-kit"
    },
    "stackAlvo": {
      "role": "fullstack",
      "languages": [
        "php",
        "javascript",
        "typescript",
        "python",
        "css",
        "html",
        "linguagens proprietárias",
        "wordpress"
      ],
      "frameworks": {
        "backend": [
          "laravel",
          "php (puro)",
          "python (django/fastapi)",
          "wordpress"
        ],
        "frontend": [
          "react",
          "vuejs",
          "angular",
          "inertia"
        ],
        "styling": [
          "tailwind css",
          "bootstrap css"
        ],
        "markup": [
          "html5",
          "css3"
        ]
      },
      "testing": [
        "phpunit",
        "playwright",
        "unit tests (todas as linguagens)"
      ],
      "devops": {
        "ci_cd": true,
        "container": [
          "docker"
        ],
        "clouds": [
          "aws",
          "gcloud",
          "azure",
          "vercel",
          "oracle",
          "dokploy"
        ]
      },
      "architecturePref": "clean architecture (adaptada por projeto)",
      "verbosityPref": "pouco verboso, direto ao ponto, bem escrito"
    },
    "harnesses": [
      "opencode",
      "antigravity-2.0",
      "antigravity-cli (agy)",
      "antigravity-ide",
      "gemini-cli",
      "claude-code",
      "codex",
      "cursor"
    ],
    "projectModes": {
      "greenfield": {
        "status": "DEFINIDO",
        "flow": "spec-first (via entrevista PO)",
        "steps": [
          "PO entrevista -> Spec/PRD",
          "Plan",
          "Tasks",
          "Implement (squad)",
          "Verify",
          "Ship"
        ],
        "docArtifact": "init gera AGENTS.md + PROJECT_CONTEXT"
      },
      "legacy": {
        "status": "DEFINIDO",
        "flow": "verify-docs -> doc-gen -> spec/change",
        "steps": [
          "verificar docs",
          "SE faltar: doc-gen",
          "PO extrai spec (reversa) + entrevista",
          "testes de caracterização",
          "SDD (Plan->Tasks->Implement->Verify->Ship)"
        ],
        "docArtifact": "analyze cria/atualiza AGENTS.md + PROJECT_CONTEXT"
      },
      "sharedRule": "Todo projeto 100% documentado; fonte de verdade = AGENTS.md + docs/PROJECT_CONTEXT.md."
    },
    "governance": "PRD.json+md (sharedContext+tasks) + ORCHESTRATION.json+md + SECURITY_LOG.json+md espelhados; ledger preenche via hook ledger-record",
    "docSync": "DOC_SYNC.json guia → multisubagents 1 func por agente → technical/functional",
    "modelSelection": "PO usa models/catalog.json local hoje; pendente integração via central-de-controle MCP GET /models/recommend quando central finalizar (spec-kit integration.controlCenter PENDENTE)"
  },
  "features": [
    {
      "id": "F01",
      "name": "Pack NPM Scaffold",
      "goal": "Estrutura do pacote instalável"
    },
    {
      "id": "F02",
      "name": "Catálogo Global — Agents",
      "goal": "7 agents globais templates + 8 squad local + 1 exemplo, todos com nome amigável e how definido"
    },
    {
      "id": "F03",
      "name": "Catálogo Global — Skills",
      "goal": "36 skills templates com gatilho/steps, segundo plano via hooks"
    },
    {
      "id": "F04",
      "name": "Harness Adapters (8 alvos)",
      "goal": "Adapters que copiam agents/skills/hooks/commands para cada harness"
    },
    {
      "id": "F05",
      "name": "Runtime — Hooks/Events/Commands/Sessions",
      "goal": "7 hooks + 4 events canônicos + 5 commands (4 SDD + models refresh) + session bootstrap em todos harnesses"
    },
    {
      "id": "F06",
      "name": "Governança",
      "goal": "PRD/ORCHESTRATION/SECURITY_LOG JSON+MD espelhados"
    },
    {
      "id": "F07",
      "name": "Documentação 100% + Doc Sync + Doc-Gen Pipeline",
      "goal": "Garantir 100% documentado técnico+funcional, casos de uso com methods/class/component"
    },
    {
      "id": "F08",
      "name": "Fluxo SDD + Dia a Dia + PO Protocol",
      "goal": "Fluxo canônico + before-task-sync + classificação dificuldade + matriz modelo por situação"
    },
    {
      "id": "F09",
      "name": "Contexto Pessoal + Projects Registry",
      "goal": "AGENTS.md GLOBAL (memória viva) + entrevista first-run + mapeamento pasta projects + continuidade cross-harness"
    },
    {
      "id": "F10",
      "name": "Segurança — Pentest Reverso",
      "goal": "Checklist 20 itens + security-gate bloqueante + SECURITY_LOG"
    },
    {
      "id": "F11",
      "name": "Ralph Loop",
      "goal": "Loop iterativo por task (3-5 iterações, .sh chat limpo, validação em testes fixos)"
    },
    {
      "id": "F12",
      "name": "Integração Central de Controle + Dashboard",
      "goal": "Central via de duas mãos (monitora/audita + recomenda modelo por harness); dashboard consome ledger"
    },
    {
      "id": "F13",
      "name": "Docs Site + Navegação",
      "goal": "Docsify com _sidebar, README linkado, per-agent/per-skill files"
    },
    {
      "id": "F14",
      "name": "Model Catalog",
      "goal": "Catálogo versionado de modelos/benchmarks para PO"
    }
  ],
  "tasks": [
    {
      "id": "T01",
      "feature": "F01",
      "what": "Scaffold pack: package.json (name spec-kit, bin spec-kit), pastas catalog/agents, catalog/skills, generators/, harnesses/<alvo>/, schemas/, models/, mcp-servers/",
      "why": "Base instalável; sem isso nada é distribuído",
      "acceptanceCriteria": "package.json válido, bin/spec-kit executável, npm pack dry-run ok, estrutura criada",
      "difficulty": "trivial",
      "model": "claude-haiku-4-5",
      "dependsOn": [],
      "status": "concluída"
    },
    {
      "id": "T02",
      "feature": "F01",
      "what": "CLI spec-kit (commander): comandos init, analyze, verify, init-projects, models refresh — com --help e --version",
      "why": "Interface do usuário; orquestra generators e adapters",
      "acceptanceCriteria": "spec-kit --help lista 5 comandos; testes unitários dos parsers",
      "difficulty": "fácil",
      "model": "claude-haiku-4-5",
      "dependsOn": [
        "T01"
      ],
      "status": "concluída"
    },
    {
      "id": "T03",
      "feature": "F01",
      "what": "Schemas JSON: prd.schema.json, orchestration.schema.json, security.schema.json, doc-sync.schema.json, project-context.schema.json",
      "why": "Validação determinística para PRD/ledger gerados",
      "acceptanceCriteria": "schemas validam PRD.json e ORCHESTRATION.json de exemplo; teste de schema ok",
      "difficulty": "médio",
      "model": "claude-sonnet-4-6",
      "dependsOn": [
        "T01"
      ],
      "status": "concluída"
    },
    {
      "id": "T04",
      "feature": "F02",
      "what": "Materializar catálogo global de agents (7) como arquivos markdown/templates em catalog/agents/ + registros em spec-kit.orchestration.json",
      "why": "Templates reutilizáveis generalistas",
      "acceptanceCriteria": "7 arquivos em catalog/agents/*.md com frontmatter id/friendlyName/cargo/funcao/how; teste verifica 7",
      "difficulty": "médio",
      "model": "claude-sonnet-4-6",
      "dependsOn": [
        "T01"
      ],
      "status": "concluída"
    },
    {
      "id": "T05",
      "feature": "F02",
      "what": "Generator de squad local (8: po, techlead, dev-senior/pleno/junior, qa, security, docs) via Context7 por stack",
      "why": "Instanciar especialistas por projeto",
      "acceptanceCriteria": "generator recebe stack (ex: laravel+react) e gera .opencode/.claude/.cursor/... com agents especialistas; teste com 2 stacks (laravel13+react19 e python+fastapi) cobrindo os 8 agents; todo agent gerado valida contra schema",
      "difficulty": "difícil",
      "model": "claude-opus-4-8",
      "dependsOn": [
        "T03",
        "T04"
      ],
      "status": "concluída"
    },
    {
      "id": "T06",
      "feature": "F02",
      "what": "Example agent domain-engine (gestor-projects) como template de extensão por domínio",